{
  "schema_version": "weekly_account_registry.v1",
  "updated_at": "2026-07-09",
  "source_export": "D:\\DDownload\\公众号 (5).json",
  "notes": "132 accounts (128 active, 0 review, 4 inactive). Added Klub.bby as Guangzhou label/collective on 2026-07-09.",
  "accounts": [
    {
      "account_id": "no8pawnshop",
      "account_name": "No8Pawnshop",
      "fakeid": "MzU2MDgyODI4OQ==",
      "aliases": [],
      "city_key": "taipei",
      "type": "unknown",
      "status": "active",
      "sync_priority": 8,
      "last_seen_at": "2026-05-08",
      "export_completed": false,
      "export_synced_count": 20,
      "export_total_count": 78,
      "avatar_url": "http://mmbiz.qpic.cn/mmbiz_png/rs5NiavrdLWuibGO4LlfibU0HLAmPkich28gqK7EyofZQPCpCxv42UBCXNkrU6ureiaEdzfPWsIj3ZBOdwKUzDFDkxA/0?wx_fmt=png",
      "source": "wechat-article-exporter",
      "city_source": "where_to_rave_map_crosscheck_20260514",
      "city_verified_at": "2026-05-14"
    },
    {
      "account_id": "socialroom",
      "account_name": "SOCIALROOM 康楽室",
      "fakeid": "Mzg4NTY1MDA4NA==",
      "aliases": [],
      "city_key": "hongkong",
      "type": "unknown",
      "status": "active",
      "sync_priority": 10,
      "last_seen_at": "2026-05-08",
      "export_completed": false,
      "export_synced_count": 3,
      "export_total_count": 3,
      "avatar_url": "http://mmbiz.qpic.cn/sz_mmbiz_png/6ribcMbSxDXUQWzkAM4EdB6cb2wuGHbOiaenHnvAsUR9BtSlKGAA1Ybr6d2DrrWujVCDwT9WHt2T2uVibH6j3AwQA/0?wx_fmt=png",
      "source": "wechat-article-exporter"
    },
    {
      "account_id": "account_d186bcf5bc",
      "account_name": "离岛唱片",
      "fakeid": "MzkwMDYzNDY1OA==",
      "aliases": [],
      "city_key": "xiamen",
      "type": "unknown",
      "status": "active",
      "sync_priority": 8,
      "last_seen_at": "2026-05-08",
      "export_completed": false,
      "export_synced_count": 20,
      "export_total_count": 369,
      "avatar_url": "http://mmbiz.qpic.cn/mmbiz_png/nyOLwNrTDghRZIV0TEPflmzoVAgLA9tICb9DpmnoNI7ejfc31awVTBNFKzUY7fHw2ebZa1Y0mSKc1OCUGbOOoxsYoAqHThgfHDSXic2H8oDw/0?wx_fmt=png",
      "source": "wechat-article-exporter",
      "city_source": "crosscheck_web_local_where_to_rave_20260514",
      "city_verified_at": "2026-05-14",
      "city_evidence_note": "INSULAR RECORDS 离岛: Apple Maps/Hypebeast 厦门交叉验证"
    },
    {
      "account_id": "tote_music",
      "account_name": "陀地音乐TOTE MUSIC",
      "fakeid": "MzAwMTY3OTI4NA==",
      "aliases": [],
      "city_key": "guangzhou",
      "type": "unknown",
      "status": "active",
      "sync_priority": 8,
      "last_seen_at": "2026-05-08",
      "export_completed": false,
      "export_synced_count": 20,
      "export_total_count": 752,
      "avatar_url": "http://mmbiz.qpic.cn/mmbiz_png/T88QWTvqKJUocqsuqGwPdsbL2wJmKkkia0XchunYvaliaTAHzc8hl5Qxo0H4HMXicJGEr5mRdWhMVKw99deiaL74tw/0?wx_fmt=png",
      "source": "wechat-article-exporter",
      "city_source": "where_to_rave_map_crosscheck_20260514",
      "city_verified_at": "2026-05-14"
    },
    {
      "account_id": "cedar_kitchen",
      "account_name": "Cedar Kitchen",
      "fakeid": "Mzg5NjIzNDMxOA==",
      "aliases": [],
      "city_key": "shanghai",
      "type": "unknown",
      "status": "active",
      "sync_priority": 8,
      "last_seen_at": "2026-05-08",
      "export_completed": false,
      "export_synced_count": 20,
      "export_total_count": 296,
      "avatar_url": "http://mmbiz.qpic.cn/sz_mmbiz_png/tVYCVWLVCxA0shv3H6PyuibZ6RAS5Tpk4oLldkB1gMXPY0KAr0NDStiaOhZbdNN5R7yM2qKoy6veeemEXNVe9kFw/0?wx_fmt=png",
      "source": "wechat-article-exporter",
      "city_source": "where_to_rave_map_crosscheck_20260514",
      "city_verified_at": "2026-05-14"
    },
    {
      "account_id": "crazy_track",
      "account_name": "Crazy Track",
      "fakeid": "Mzk0NTY4OTUwNA==",
      "aliases": [],
      "city_key": "beijing",
      "type": "unknown",
      "status": "active",
      "sync_priority": 8,
      "last_seen_at": "2026-05-08",
      "export_completed": false,
      "export_synced_count": 20,
      "export_total_count": 209,
      "avatar_url": "http://mmbiz.qpic.cn/mmbiz_png/qhvumIWfGYdagnuMIaplicrUX0dicXl07OnCVKYdO9ylkjElYCKXWP8FIMpX4Serkor5edqNrMv9R9eLcxZDbRGg/0?wx_fmt=png",
      "source": "wechat-article-exporter",
      "city_source": "crosscheck_web_local_where_to_rave_20260514",
      "city_verified_at": "2026-05-14",
      "city_evidence_note": "Where To Rave map: 北京 Track/Crazy Track"
    },
    {
      "account_id": "vinyl",
      "account_name": "黑胶Vinyl",
      "fakeid": "MjM5MTc5NzgwNA==",
      "aliases": [],
      "city_key": "",
      "type": "unknown",
      "status": "inactive",
      "sync_priority": 8,
      "last_seen_at": "2026-05-08",
      "export_completed": false,
      "export_synced_count": 17,
      "export_total_count": 343,
      "avatar_url": "http://mmbiz.qpic.cn/mmbiz_png/yjDYn1ic8XqXLKKTGficH3ythkheDv5Lw3iaeLNmiaKic9VSicykYHAPL0MIHgaCb4YDiacsdnjoiaicjyicvzs1nKb6AeIQ/0?wx_fmt=png",
      "source": "wechat-article-exporter",
      "city_scope": "online",
      "inactive_reason": "inactive: 本地下载最新样例停留在旧音乐资讯/媒体内容，暂不作为城市活动源发布",
      "inactive_verified_at": "2026-05-14"
    },
    {
      "account_id": "account_a503b643c6",
      "account_name": "越界电波",
      "fakeid": "MzkwNzYyMDE5Nw==",
      "aliases": [],
      "city_key": "guangzhou",
      "type": "unknown",
      "status": "active",
      "sync_priority": 8,
      "last_seen_at": "2026-05-08",
      "export_completed": false,
      "export_synced_count": 20,
      "export_total_count": 98,
      "avatar_url": "http://mmbiz.qpic.cn/sz_mmbiz_png/QRHOmhKeEViaxBhCsaDlTWKEhl7picSq3DlhAW3TibwJdVhzVdCLibSDpguEia7XNVxT40skbQ7sGE149H2vDmicXprw/0?wx_fmt=png",
      "source": "wechat-article-exporter",
      "city_source": "crosscheck_web_local_where_to_rave_20260514",
      "city_verified_at": "2026-05-14",
      "city_evidence_note": "本地下载文章多次出现广州场景/活动"
    },
    {
      "account_id": "wakeywakey",
      "account_name": "WakeyWakey",
      "fakeid": "MzkwOTYwMjcxNw==",
      "aliases": [],
      "city_key": "beijing",
      "type": "unknown",
      "status": "active",
      "sync_priority": 10,
      "last_seen_at": "2026-05-08",
      "export_completed": false,
      "export_synced_count": 20,
      "export_total_count": 42,
      "avatar_url": "http://mmbiz.qpic.cn/sz_mmbiz_png/FslGesBhbUtkgV50HtxdCtGSmzOBricn6BHgl05SJdWYroiaGLMFnhwjIKXj7NgsYMNobORIiag5gFquMYFkBxs2A/0?wx_fmt=png",
      "source": "wechat-article-exporter"
    },
    {
      "account_id": "knock_knockclub",
      "account_name": "敲敲电子俱乐部 KNOCK&KNOCKCLUB",
      "fakeid": "Mzk1NzUzNzg4OA==",
      "aliases": [],
      "city_key": "changchun",
      "type": "club",
      "status": "active",
      "sync_priority": 8,
      "last_seen_at": "2026-05-08",
      "export_completed": false,
      "export_synced_count": 20,
      "export_total_count": 158,
      "avatar_url": "http://mmbiz.qpic.cn/mmbiz_png/z9FybuOUGtnU339oT4zOsOq4mVNxI8bQ0UqVMT24icV4KDQA8PEnuRl80oibiaBmGhojicDfOcKJcXLK0MDfahiatvg/0?wx_fmt=png",
      "source": "wechat-article-exporter",
      "city_source": "where_to_rave_map_crosscheck_20260514",
      "city_verified_at": "2026-05-14"
    },
    {
      "account_id": "rust_club",
      "account_name": "Rust Club 锈蚀俱乐部",
      "fakeid": "Mzg4MDEyOTY1MA==",
      "aliases": [],
      "city_key": "daqing",
      "type": "club",
      "status": "active",
      "sync_priority": 8,
      "last_seen_at": "2026-05-08",
      "export_completed": false,
      "export_synced_count": 20,
      "export_total_count": 175,
      "avatar_url": "http://mmbiz.qpic.cn/mmbiz_png/UnJ8aX6FAd7ozMOI2IvsBf2gibLQlcaRt9gf7B5sxYrecKnHdPZow4iaE9dMdWnibMA6EIFrQuTalyTIwch8RSKoA/0?wx_fmt=png",
      "source": "wechat-article-exporter",
      "city_source": "where_to_rave_map_crosscheck_20260514",
      "city_verified_at": "2026-05-14"
    },
    {
      "account_id": "nuts",
      "account_name": "坚果NUTS",
      "fakeid": "MjM5OTA3NDIyMA==",
      "aliases": [],
      "city_key": "chongqing",
      "type": "unknown",
      "status": "active",
      "sync_priority": 8,
      "last_seen_at": "2026-05-08",
      "export_completed": false,
      "export_synced_count": 20,
      "export_total_count": 4986,
      "avatar_url": "http://mmbiz.qpic.cn/mmbiz_png/ydZdDicye41UYibffU6KP3HqRzA3xyNz89XAbhqZkF11ibQhBYxFcqeN9wxYKjX4WiakBm7ZxQ0TTJetVCOI2bwNfQ/0?wx_fmt=png",
      "source": "wechat-article-exporter",
      "city_source": "where_to_rave_map_crosscheck_20260514",
      "city_verified_at": "2026-05-14"
    },
    {
      "account_id": "account_eae77d1173",
      "account_name": "开心舞厅",
      "fakeid": "MjM5MjA2OTQ1OA==",
      "aliases": [],
      "city_key": "weifang",
      "type": "unknown",
      "status": "active",
      "sync_priority": 8,
      "last_seen_at": "2026-05-08",
      "export_completed": false,
      "export_synced_count": 17,
      "export_total_count": 17,
      "avatar_url": "http://mmbiz.qpic.cn/mmbiz_png/FEJ9iaZOIYOSqyNgTsoo4hBuibyLIXz1Wspz6xWEBc56icx30cO1asAQg7JENw74icw4A9icLV7UwMpCibicfCwMuqEOg/0?wx_fmt=png",
      "source": "wechat-article-exporter",
      "city_source": "where_to_rave_map_crosscheck_20260514",
      "city_verified_at": "2026-05-14"
    },
    {
      "account_id": "account_fdb418f21a",
      "account_name": "仙境俱乐部",
      "fakeid": "MzIxOTUwODM0OQ==",
      "aliases": [],
      "city_key": "shenyang",
      "type": "club",
      "status": "active",
      "sync_priority": 8,
      "last_seen_at": "2026-05-08",
      "export_completed": false,
      "export_synced_count": 20,
      "export_total_count": 626,
      "avatar_url": "http://mmbiz.qpic.cn/mmbiz_png/x5B93YtPyoIjbVDwlZ80VjW6THotxBa8Qz7nEcDtib3bUClVy7B63IteeVzcHEOVW1NebkIkgWZkWBmib0GYXSUA/0?wx_fmt=png",
      "source": "wechat-article-exporter",
      "city_source": "where_to_rave_map_crosscheck_20260514",
      "city_verified_at": "2026-05-14"
    },
    {
      "account_id": "bar_sos",